{
  "schema_version": "1.0.0",
  "event_id": "evt-reqsys-0001",
  "event_type": "requirement.created",
  "event_class": "PRODUCT_INTELLIGENCE",
  "occurred_at": "2026-06-24T00:00:00Z",
  "source": {
    "system": "reqsys",
    "channel": "ui",
    "actor_type": "user",
    "actor_id": "masked-user"
  },
  "requirement": {
    "id": "REQ-0001",
    "title": "Registrar requisito funcional com rastreabilidade",
    "type": "functional",
    "status": "draft",
    "priority": "must",
    "confidence": "medium"
  },
  "quality": {
    "bdd_coverage": 0,
    "ambiguity_score": 30,
    "traceability_score": 20,
    "risk_score": 40,
    "readiness_score": 35
  },
  "traceability": {
    "parent_ids": [],
    "linked_prs": [],
    "linked_tests": [],
    "linked_decisions": [],
    "linked_risks": []
  },
  "governance": {
    "correlation_id": "corr-reqsys-0001",
    "pii_masked": true,
    "human_review_required": true,
    "ai_generated": false,
    "evidence_level": "partial"
  }
}
